{
  "schema_version": "1.0",
  "id": "ccar-f-practice",
  "title": "Claude Certified Architect – Foundations — Practice Set",
  "description": "Direct import of the CCAR-F practice question set (Matthew Purcell) — 60 scenario-based questions at exam-level difficulty, with rationales, filed by blueprint domain.",
  "generated_by": "build_tutor_packages.py (direct import)",
  "generated_at": "2026-08-06T17:11:30Z",
  "sources": [
    {
      "id": "ccar-f-practice-src",
      "title": "Claude Certified Architect – Foundations — Practice Question Set",
      "kind": "pdf",
      "extractor": "extract_practice.py",
      "uri": "claude_certified_architect_foundations.pdf"
    }
  ],
  "source_ids": [
    "ccar-f-practice-src"
  ],
  "taxonomy": {
    "domains": [
      {
        "id": "D1",
        "title": "Agentic Architecture & Orchestration",
        "weight": 0.27
      },
      {
        "id": "D2",
        "title": "Tool Design & MCP Integration",
        "weight": 0.18
      },
      {
        "id": "D3",
        "title": "Claude Code Configuration & Workflows",
        "weight": 0.2
      },
      {
        "id": "D4",
        "title": "Prompt Engineering & Structured Output",
        "weight": 0.2
      },
      {
        "id": "D5",
        "title": "Context Management & Reliability",
        "weight": 0.15
      }
    ]
  },
  "concepts": [
    {
      "id": "d1-c",
      "title": "Agentic Architecture & Orchestration",
      "domain": "D1"
    },
    {
      "id": "d2-c",
      "title": "Tool Design & MCP Integration",
      "domain": "D2"
    },
    {
      "id": "d3-c",
      "title": "Claude Code Configuration & Workflows",
      "domain": "D3"
    },
    {
      "id": "d4-c",
      "title": "Prompt Engineering & Structured Output",
      "domain": "D4"
    },
    {
      "id": "d5-c",
      "title": "Context Management & Reliability",
      "domain": "D5"
    }
  ],
  "questions": [
    {
      "id": "ccar-f-practice-q001",
      "concept_ids": [
        "d1-c"
      ],
      "type": "mcq_single",
      "render": "radio",
      "difficulty": 4,
      "stem": "You are implementing the agent's core loop. Which control flow correctly determines when to keep executing tools and when to present the final response?",
      "options": [
        {
          "id": "a",
          "text": "Continue looping until the assistant's text contains a phrase like \"I have resolved the issue\", then stop",
          "correct": false
        },
        {
          "id": "b",
          "text": "Inspect stop_reason on each response: while it is \"tool_use\", execute the requested tools and return results for the next iteration; when it is \"end_turn\", present the final response",
          "correct": true
        },
        {
          "id": "c",
          "text": "Run exactly five iterations, since support cases rarely need more tool calls than that",
          "correct": false
        },
        {
          "id": "d",
          "text": "Stop as soon as any response contains text content, since text indicates completion ",
          "correct": false
        }
      ],
      "explanation": "The agentic loop keys off stop_reason: \"tool_use\" means the model has requested tools and expects their results back; \"end_turn\" means it has finished reasoning and produced its answer. That signal is the designed termination mechanism. Why not the others: A parses natural language for a completion signal - a documented anti-pattern; C makes an arbitrary iteration cap the primary stopping mechanism; D fails because responses can contain both text and tool_use blocks mid-task.",
      "tags": [
        "scenario-1",
        "Customer Support Resolution Agent",
        "item-1.1"
      ]
    },
    {
      "id": "ccar-f-practice-q002",
      "concept_ids": [
        "d1-c"
      ],
      "type": "mcq_single",
      "render": "radio",
      "difficulty": 4,
      "stem": "The agent calls lookup_order and your code executes it successfully. How does the model actually receive the order data so it can reason about the next action?",
      "options": [
        {
          "id": "a",
          "text": "The MCP server pushes the result directly into the model's memory",
          "correct": false
        },
        {
          "id": "b",
          "text": "The model re-reads the tool's description, which now includes the result",
          "correct": false
        },
        {
          "id": "c",
          "text": "Nothing is required - the API executes tools and incorporates results automatically",
          "correct": false
        },
        {
          "id": "d",
          "text": "Your code appends a tool result block (referencing the tool call's ID) to the conversation history and sends the updated messages back to Claude in the next request ",
          "correct": true
        }
      ],
      "explanation": "Tool execution is the harness's job: the loop appends the tool result to the conversation and re-invokes the model. That growing history is the only channel through which the model sees what tools returned. Why not the others: A and C describe automatic mechanisms that do not exist - the API does not execute your tools; B confuses static tool definitions with runtime results.",
      "tags": [
        "scenario-1",
        "Customer Support Resolution Agent",
        "item-1.2"
      ]
    },
    {
      "id": "ccar-f-practice-q003",
      "concept_ids": [
        "d1-c"
      ],
      "type": "mcq_single",
      "render": "radio",
      "difficulty": 4,
      "stem": "Company policy caps autonomous refunds at $500; larger refunds must go to a human. In testing, prompt instructions alone still let an occasional $650 refund through. What is the correct enforcement design?",
      "options": [
        {
          "id": "a",
          "text": "Implement a hook that intercepts outgoing process_refund calls, blocks any amount above $500, and redirects the agent to the escalate_to_human workflow",
          "correct": true
        },
        {
          "id": "b",
          "text": "Move the $500 limit to the top of the system prompt and repeat it in every user turn",
          "correct": false
        },
        {
          "id": "c",
          "text": "Lower the model temperature so it follows the policy more consistently",
          "correct": false
        },
        {
          "id": "d",
          "text": "Add the limit to the process_refund tool description so the model reads it during selection ",
          "correct": false
        }
      ],
      "explanation": "Business rules with financial consequences need deterministic guarantees. A tool-call interception hook enforces the threshold in code - the violating call can never execute - while prompt-based approaches remain probabilistic. Why not the others: B and D improve the odds but retain a non-zero failure rate, which the scenario shows is unacceptable here; C misapplies a sampling parameter to a compliance problem.",
      "tags": [
        "scenario-1",
        "Customer Support Resolution Agent",
        "item-1.3"
      ]
    },
    {
      "id": "ccar-f-practice-q004",
      "concept_ids": [
        "d1-c"
      ],
      "type": "mcq_single",
      "render": "radio",
      "difficulty": 4,
      "stem": "A customer writes one message containing three concerns: a refund for a damaged item, a shipping address change, and a missing loyalty credit. How should the agent handle this?",
      "options": [
        {
          "id": "a",
          "text": "Resolve only the refund, since it was mentioned first, and wait for the customer to raise the others again",
          "correct": false
        },
        {
          "id": "b",
          "text": "Escalate immediately - multi-issue messages always exceed agent capability",
          "correct": false
        },
        {
          "id": "c",
          "text": "Decompose the message into three distinct items, investigate each (in parallel where possible) using the shared customer context, then synthesize one unified resolution covering all three",
          "correct": true
        },
        {
          "id": "d",
          "text": "Ask the customer to resend each issue as a separate message  ",
          "correct": false
        }
      ],
      "explanation": "Multi-concern decomposition is the designed pattern: split the request into distinct items, investigate each against shared context, and respond once with a complete resolution - protecting first-contact resolution. Why not the others: A and D silently drop or bounce concerns the customer already stated, directly harming FCR; B escalates work that is well within capability.",
      "tags": [
        "scenario-1",
        "Customer Support Resolution Agent",
        "item-1.4"
      ]
    },
    {
      "id": "ccar-f-practice-q005",
      "concept_ids": [
        "d1-c"
      ],
      "type": "mcq_single",
      "render": "radio",
      "difficulty": 4,
      "stem": "The agent must escalate a complex billing dispute mid-process. The human agents receiving escalations do not have access to the conversation transcript. What should the escalation include?",
      "options": [
        {
          "id": "a",
          "text": "Only the customer's name, so the human can start fresh without bias",
          "correct": false
        },
        {
          "id": "b",
          "text": "A structured handoff summary: customer ID, the root cause analysis so far, relevant amounts and order numbers, and the agent's recommended action",
          "correct": true
        },
        {
          "id": "c",
          "text": "A sentiment score describing how upset the customer is",
          "correct": false
        },
        {
          "id": "d",
          "text": "The raw JSON of every tool result gathered during the session ",
          "correct": false
        }
      ],